{"slug":"afterpay","name":"Afterpay","aliases":["Clearpay"],"kind":"service","category":"Payments","description":"Buy-now-pay-later service owned by Block, Inc.","founded":2014,"country":"AU","parent":{"market":"US","ticker":"XYZ","url":"https://cdn.jsdelivr.net/gh/MrChartist/global-stock-logos@main/api/v1/companies/us/XYZ.json"},"otherListedOwners":[],"owners":[{"market":"US","ticker":"XYZ","role":"parent","url":"https://cdn.jsdelivr.net/gh/MrChartist/global-stock-logos@main/api/v1/companies/us/XYZ.json"}],"markets":["US"],"website":"https://www.afterpay.com","wikidata":"Q55639119","brandColor":"#000000","brandInk":{"color":"#FFFFFF","theme":"dark","contrast":21},"onDark":false,"logo":{"url":"https://cdn.jsdelivr.net/gh/MrChartist/global-stock-logos@main/brands/logos/afterpay.svg","format":"svg","svg":"https://cdn.jsdelivr.net/gh/MrChartist/global-stock-logos@main/brands/logos/afterpay.svg","mark":null,"png":{"256":"https://cdn.jsdelivr.net/gh/MrChartist/global-stock-logos@main/brands/png/256/afterpay.png","512":"https://cdn.jsdelivr.net/gh/MrChartist/global-stock-logos@main/brands/png/512/afterpay.png","1024":"https://cdn.jsdelivr.net/gh/MrChartist/global-stock-logos@main/brands/png/1024/afterpay.png"}},"sources":{"logo":"https://en.wikipedia.org/wiki/File:Afterpay_logo.svg","logoType":"wikipedia","ownership":"https://www.sec.gov/Archives/edgar/data/1512673/000162828026012254/xyz-20251231.htm","facts":{"founded":"https://en.wikipedia.org/wiki/Afterpay","country":"https://en.wikipedia.org/wiki/Afterpay"},"checkedAt":"2026-10-22"},"links":{"self":"https://cdn.jsdelivr.net/gh/MrChartist/global-stock-logos@main/api/v1/brands/afterpay.json"}}